{
  "evidence_id": "55555555-5555-4555-8555-555555555555",
  "job_id": "11111111-1111-4111-8111-111111111111",
  "tool_call_id": "66666666-6666-4666-8666-666666666666",
  "connector": "public_web",
  "resource_uri": "https://example.com/public-research/latency-guide",
  "source_locator": "Public latency guide, section 2",
  "title": "Common causes of query latency",
  "retrieved_at": "2026-10-23T12:10:00Z",
  "content_sha256": "66f43a7efe01df12f99363ee23879cee2caee9afa4c548b1602f49207a1aa13f",
  "artifact_ref": "obj-public-evidence-example-1",
  "excerpt": "Queue depth and downstream timeout settings can affect tail latency.",
  "classification": "public",
  "access_context_ref": "ctx-public-example-1",
  "upstream_tool": "fetch_public_page"
}
